{
  "show_id": "geopoai",
  "episode_id": "demo_ep_001",
  "format_targets": ["horizontal"],
  "stages": {
    "ingest": { "status": "done", "artifact": "evidence.json" },
    "script": { "status": "done", "artifact": "script.json" },
    "render": { "status": "pending" }
  },
  "evidence": [
    {
      "id": "ev1",
      "source": "https://example.com/report",
      "retrieved_at": "2026-06-17T12:00:00Z",
      "claim": "Example claim for fixture validation."
    }
  ],
  "script": {
    "beats": [
      {
        "beat_id": "hook",
        "vo_text": "Why does **cooperation** fail here?",
        "evidence_refs": ["ev1"]
      }
    ]
  },
  "storyboard": {
    "entries": [
      {
        "beat_id": "hook",
        "clip_id": "demo_hook",
        "renderer": "manim",
        "scene_ref": "scenes/demo_hook.json",
        "duration": 8.0
      }
    ]
  },
  "clips": [
    {
      "id": "demo_hook",
      "renderer": "manim",
      "outputs": {
        "video": "output/demo_hook.mp4"
      }
    }
  ],
  "compose": {
    "spec_path": "compose/demo_ep_001.json"
  },
  "qc": {
    "status": "pending"
  },
  "publish": {
    "profiles": ["yt_long"]
  }
}
